"Matched Company","Match Score","Industry","Verticals","Explanation"
"EcoHarvest Technologies","90.0","AgriTech","Sustainable Agriculture, IoT, AI","Strong match due to overlapping AgriTech focus and complementary IoT/AI technologies in smart farming."
"SmartCity Solutions","80.0","AgriTech","Urban Planning, IoT, Sustainability","Strong match due to overlapping AgriTech focus and complementary IoT technologies in smart systems."
"LogisticsPro","75.0","Logistics","Supply Chain, IoT, Analytics","Strong overlap in IoT and potential synergy in AI for supply chain optimization and smart farming."
"CleanEnergy Solutions","70.0","CleanTech","Renewable Energy, Smart Grid, Sustainability","Strong potential match due to shared focus on sustainability and complementary IoT/AI technologies in agriculture and energy."
"HealthBridge","60.0","HealthTech","Telemedicine, AI Diagnostics, Healthcare","Potential match with shared interest in AI and complementary IoT technology in AgriTech."
"CyberShield AI","60.0","Cybersecurity","AI Security, Blockchain, Cloud Security","Potential match due to shared interest in AI, but different industries (AgriTech, Cybersecurity) may require adaptation."
"EduTech Plus","60.0","EdTech","Online Learning, AI Tutoring, EdTech","Potential match due to shared interest in AI, but different industries (AgriTech vs EdTech) may present challenges."
"RetailAI","60.0","Retail","E-commerce, AI, Customer Analytics","Overlapping AI technology, but different industries may require significant adaptation."
"BioTech Innovations","60.0","BioTech","Drug Discovery, AI, Healthcare","Potential match due to shared interest in AI, but different industries (AgriTech vs BioTech) may require adaptation."
